NomCommercial;Marque;FormeGalenique;ResponsableEtiquetage;DoseJournaliere;ModeEmploi;MisesEnGarde;Gamme;Aromes;population_a_risques;plantes;familles_plantes;parties_plantes;autres_ingredients;objectif_effet
Life Extension Mix Capsules;Life Extension;Capsule;by nature b.v.;2;Prendre 2 capsules par jour avec un repas et beaucoup d'eau.;Avertissements:Les compléments alimentaires ne se substituent pas à un régime alimentaire varié et équilibréet à un mode de vie sain. A conserver hors de portée des jeunes enfants. Ne pas dépasser la dose journalière recommandée.Ce produit est un complément alimentaire, à conserver dans un endroit frais et sec, à l'abri de la lumière.Contient de la caféine. Déconseillé aux femmes enceintes et allaitantes, aux enfants et aux adolescents ainsi qu'auxpersonnes souffrant d'hypothyroïdie ou prenant des médicaments pour la thyroïde.;;;Adolescents (moins de 18 ans),Enfants (moins de 12 ans),Enfants en bas âge (1 à 3 ans),Nourrissons (moins de 1 an),Enfants (de moins de 6 ans),Enfants (de moins de 10 ans);Aristotelia chilensis (Molina) Stuntz,Withania somnifera (L.) Dunal,Brassica oleracea L.,Camellia sinensis (L.) Kuntze,Diospyros kaki Thunb.,Malpighia glabra L.,Olea europaea L.,Phyllanthus emblica L.,Prunus avium (L.) L.,Cerasus vulgaris Mill.,Prunus domestica L.,Punica granatum L.,Ribes nigrum L.,Rubus fruticosus L.,Sambucus nigra L.,Sesamum indicum L.,Silybum marianum (L.) Gaertn.,Styphnolobium japonicum (L.) Schott,Tagetes erecta L.,Solanum lycopersicum L.,Vaccinium macrocarpon Aiton,Vaccinium myrtillus L.,Vitis vinifera L.;;;Béta-carotène,Acétate de rétinyle,L-ascorbate de calcium,Acide L-ascorbique,6-palmitate de L-ascorbyl,L-ascorbate de magnésium,Cholécalciférol,Succinate acide de D-alpha-tocophéryle,D-alpha-tocophérol,Chlorhydrate de thiamine,Riboflavine,Riboflavine 5'-phosphate,Nicotinamide,Pyridoxal 5'-phosphate,Chlorhydrate de pyridoxine,L-méthylfolate de calcium,Méthylcobalamine,D-biotine,D-pantothénate de calcium,Iodure de potassium,Oxyde de magnésium,Citrate-malate de magnésium,Bisglycinate de magnésium,Citrate de zinc,Sulfate de zinc mono-L-méthionine,Sélénite de sodium,Levure enrichie en sélénium,Bisglycinate de cuivre,Citrate de manganèse,Gluconate de manganèse,Picolinate de chrome,Shilajit,Molybdate de sodium,Citrate de potassium,E920,Inositol,Citroflavonoïdes,Taurine,Bétaïne,Mélange de tocophérols,Phosphatidylcholine,Bromélaïne,Borate de sodium,gélatine,maltodextrine,E470b,E551,amidon;
Elixir floral d'Avoine;L'Herberaie;Compte-gouttes;JACQUEMIN ARLETTE;12 gouttes par jour;4 gouttes 3 fois par jour;Complément alimentaire ne pouvant se substituer à une alimentation variée et équilibrée. A consommer dans le cadre d'un mode de vie sain. Tenir hors de portée des enfants. Ne pas dépasser la dose journalière recommandée. Déconseillé au enfants de moins de 12 ans, femmes enceintes ou allaitantes. A conserver à température ambiante, dans un endroit sec et à l'abri de la lumière;Elixirs floraux;;Allaitement,Enfants (moins de 12 ans),Grossesse;Avena sativa L.;Poaceae;Parties aériennes;Cognac,Eau osmosée dynamisée;
NR-3 COMPLÉMENT ALIMENTAIRE À BASE DE VITAMINES ET MINÉRAUX;;Gélule;L-Nutra Italia S.r.l.;1 GÉLULE;;AVERTISSEMENTS: Ne pas dépasser la dose quotidienne recommandée. Les compléments ils ne sont pas destinés à se substituer à une alimentation variée. Tenir hors de la portée des enfants.;;;Enfants (moins de 12 ans),Enfants en bas âge (1 à 3 ans),Nourrissons (moins de 1 an),Enfants (de moins de 6 ans),Enfants (de moins de 10 ans);;;;E470b,E1204,Oxyde de magnésium,Acide L-ascorbique,Gluconate de zinc,Acétate de DL-alpha-tocophéryle,Nicotinamide,Levure enrichie en sélénium,Chlorhydrate de pyridoxine,Chlorhydrate de thiamine,Gluconate de cuivre,Acide ptéroylmonoglutamique,D-biotine,Cyanocobalamine,Béta-carotène,D-pantothénate de calcium,Riboflavine;
SUPER DRAINEUR BIO;BOBO GELULES;Gélule;LABORATOIRES DU DOCTEUR BOBO;2 gélules;Prendre 2 gélules le matin, avec un verre d'eau;;BOBO GELULES;;Adolescents (moins de 18 ans),Allaitement,Enfants (moins de 12 ans),Enfants en bas âge (1 à 3 ans),Grossesse,Nourrissons (moins de 1 an),Enfants (de moins de 6 ans),Enfants (de moins de 10 ans);Aesculus hippocastanum L.,Equisetum arvense L.,Passiflora incarnata L.,Vitis vinifera L.;;;saccharose,E464,Gélule végétale;Circulation sanguine et lymphatique,Détoxifiant / Draineur,Gestion du poids / minceur
Frene macérat mère;La Terre mère;Compte-gouttes;ROSTAING TAYARD CLAIRE;5 à 15 gouttes;A diluer dans un verre d'eau à jeun;Respecter les doses conseilléesNe peut se substituer à une alimentation variée et équilibréeTenir hors de la portée des enfantsConserver à l'abri de la chaleur et la lumièreUn léger dépôt est possibleEnfants, femmes enceintes et allaitantes se référer à l'avis d'un médecin ou d'un thérapeute spécialisé.;gemmothérapie;;;Fraxinus excelsior L.;Oleaceae;Bourgeon;eau de source,Alcool,E422;Articulations,Autre (à préciser)
CITRONNELLE BIO;ELFIA NATURE;Compte-gouttes;SAS ELFIA NATURE;3 gouttes;A utiliser dans le cadre d'une alimentation équilibrée;Ne pas appliquer sur la peau avant une exposition solaireNe pas dépasser la dose journalière recommandéeTenir hors de portée des enfants. Eviter tout contact avec les yeux.Il est recommandé de prendre conseil auprès d'un professionnel de santéDéconseillé aux enfants de moins de 6 ans;;;Allaitement,Autre (à préciser),Grossesse,Utilisation prolongée;Cymbopogon winterianus Jowitt ex Bor;Poaceae;Essence (parties aériennes);;
Capteur graisses et sucres;LF;Gélule;ISIS GROUP;12 gélules;Prendre 4 gélules avec un verre d’eau 15 à 60 min après chaque repas riche en graisses et/ou sucres.;;;;;Opuntia ficus-indica (L.) Mill.;Cactaceae;Feuille;Bitartrate de choline,E464;Minceur / Capteur
LAVENDER ROYAL;VITALITY NUTRITIONALS;Capsule;Vision Healthcare B.V.;1 GÉLULE;;Déconseilléaux enfants, aux femmes enceintes et à cellesqui allaitent.;;;Autre (à préciser);Lavandula angustifolia Mill.,Passiflora incarnata L.;;;E414,E464,Méthylcobalamine;
Extrait d'ail noir;;Capsule;Good Organics GmbH;1 capsule;;;;;Enfants (moins de 12 ans);Allium sativum L.;Amaryllidaceae;Essence (bulbe);;
Cordyceps, Shitake & Reishi;;Capsule;Good Organics GmbH;3 capsules;;;;;Enfants (moins de 12 ans);Ophiocordyceps sinensis,Ganoderma lucidum(Curtis ex Fr.) P.Karst.,Lentinula edodes(Berk.) Pegler;;;;
Cuivre Gluconate;D.Plantes;Gélule;DIRECT PLANTES;1 gélule par jour;1 gélule par jour, à prendre au moment des repas, pendant 1 mois à renouveler.;Déconseillé chez les femmes enceintes ou allaitantes et chez l’enfant de moins de 11 ans.;Minéraux;;Allaitement,Autre (à préciser),Grossesse;;;;E414,Gélatine de poisson,Gluconate de cuivre;Cheveux et ongles,Immunité,Peau
Magnétaunus-Royal;La Royale;Sachet;LuxPlantes S.A.;1 sachet;A prendre avec un verre d'eau (20 cl);Tenir hors de portée des jeunes enfants. Respecter les conseils d'utilisation et ne pas les dépasser sans l'avis d'un professionnel de santé. Ne peut se substituer à une alimentation équilibrée, variée et à un mode de vie sain.Ne pas administrer aux enfants et aux adolescents de moins de 18 ans.;;;Adolescents (moins de 18 ans),Enfants (moins de 12 ans),Enfants en bas âge (1 à 3 ans),Nourrissons (moins de 1 an),Enfants (de moins de 6 ans),Enfants (de moins de 10 ans);;;;L-Arginine-alpha-cétoglutarate,Chlorhydrate de thiamine,Riboflavine,Nicotinamide,D-pantothénate de calcium,Chlorhydrate de pyridoxine,Cyanocobalamine,D-biotine,Acide ptéroylmonoglutamique,Taurine,Sels de magnésium de l'acide citrique;Autre (à préciser)
Extrait de pépins de pamplemousse et Vitamine D;Secrets de Miel;Compte-gouttes;MELISHOP;10 gouttes soit  0.44 ml ou 440 mg;10 gouttes dans un verre d'eau ou de jus de fruit le matin.;Tenir hors de portée des enfants.;;;;Citrus maxima (Burm.) Merr.;Rutaceae;Graine;E330,Cholécalciférol,Eau purifiée,E202;Immunité
SPIRULINE;TVD Santé;Gélule;OCDI;3 gélules;Avalez 1 gélule matin, midi et soir avec un peu d’eau, pendant les repas.;"Déconseillé aux fumeurs en raison de la présence de bêta-carotène dans la Spiruline. Tenir hors de portée des jeunes enfants.							Ne pas dépasser la dose journalière recommandée.							Ne peut remplacer une alimentation variée et équilibrée. Il est important de maintenir un mode de vie sain.							A conserver au frais, au sec et à l’abri de la lumière.";;;Autre (à préciser);Spirulina platensis (Gomont) Geitler;Spirulinaceae;Plante entière;Acide L-ascorbique,gélatine,E470b;Autre (à préciser)
"[""EQUIFER + B12"", ""EQUIFER + B12""]";;"[""Gélule"", ""Gélule""]";"[""LES PATTES DOUCES"", ""LES PATTES DOUCES""]";"[""2 gélules"", ""3 gélules""]";"[""Prendre 2 gélules le soir, au cours du dîner ou avant le coucher."", ""Prendre 3 gélules le soir, au cours du dîner ou avant le coucher.""]";"[""Déconseillé aux personnes souffrant de maladies ayant pour conséquence une accumulation anormale de fer (hémochromatose, polyglobuline...). Déconseillé aux enfants et aux adolescents. Prendre un avis médical en cas de grossesse ou d'allaitement."", ""Déconseillé aux personnes souffrant de maladies ayant pour conséquence une accumulation anormale de fer (hémochromatose, polyglobuline...). Déconseillé aux enfants et aux adolescents. Prendre un avis médical en cas de grossesse ou d'allaitement.""]";;;Adolescents (moins de 18 ans),Allaitement,Autre (à préciser),Enfants (moins de 12 ans),Enfants en bas âge (1 à 3 ans),Grossesse,Nourrissons (moins de 1 an),Enfants (de moins de 6 ans),Enfants (de moins de 10 ans),Adolescents (moins de 18 ans),Allaitement,Autre (à préciser),Enfants (moins de 12 ans),Enfants en bas âge (1 à 3 ans),Grossesse,Nourrissons (moins de 1 an),Enfants (de moins de 6 ans),Enfants (de moins de 10 ans);;;;;Autre (à préciser),Autre (à préciser)
Ampoule vitalité;La Vie Claire;Ampoule;LA VIE CLAIRE;1 ampoule;1 ampoule par jour, pure ou diluée dans un verre d’eau ou de jus;Il est recommandé de ne pas dépasser la dose journalière indiquée. À tenir hors de la portée des jeunes enfants. Les compléments alimentaires doivent être consommés dans le cadre d’un mode de vie sain et ne pas être utilisés comme substituts d’un régime alimentaire varié et équilibré.Déconseillé pour les personnes sous traitement antidiabétique. À conserver à l’abri de la lumière et de la chaleur.;Ampoules;;Enfants en bas âge (1 à 3 ans),Nourrissons (moins de 1 an),Sous antidiabétiques;Malpighia glabra L.,Panax ginseng C.A.Mey.,Zingiber officinale Roscoe;;;eau,Gelée royale;
Complexe Vsen21;Nutri Prescription Paris;Gélule;PHARMAVANCE GROUPEMENT;2 gélules par jour;prendre 2 gélules par jour de préférence le matin;Ce produit ne doit pas de substituer à une alimentation diversifiée et équilibrée et à un mode de vie sain. Respecter les conseils d'utilisation, la dose journalière conseillée et la date limite d'utilisation. Déconseillé aux femmes enceintes et allaitantes et enfants de moins de 15 ans. Tenir hors de portée des jeunes enfants.;;;Adolescents (moins de 18 ans),Allaitement,Grossesse;Spirulina platensis (Gomont) Geitler;Spirulinaceae;Plante entière;Acide L-ascorbique,maltodextrine,Oxyde de magnésium,Lutéine,Pyrophosphate ferrique,Acétate de D-alpha-tocophéryle,Huile de Schizochytrium sp,D-pantothénate de calcium,Oxyde de zinc,E470b,Nicotinamide,Sulfate de manganèse,Rétinol,Riboflavine,Chlorhydrate de thiamine,Chlorhydrate de pyridoxine,Cholécalciférol,Cyanocobalamine,Acide ptéroylmonoglutamique,Chlorure de chrome,D-biotine,Gélule végétale;Autre (à préciser)
Ampoule relaxation;La Vie Claire;Ampoule;LA VIE CLAIRE;1 ampoule;1 ampoule par jour, pure ou diluée dans un verre d’eau ou de jus;Il est recommandé de ne pas dépasser la dose journalière indiquée. À tenir hors de la portée des jeunes enfants. Les compléments alimentaires doivent être consommés dans le cadre d’un mode de vie sain et ne pas être utilisés comme substituts d’un régime alimentaire varié et équilibré. L'emploi est déconseillé aux enfants de moins de 12 ans. À conserver à l’abri de la lumière et de la chaleur.;Ampoules;;Enfants (moins de 12 ans),Enfants en bas âge (1 à 3 ans),Nourrissons (moins de 1 an),Enfants (de moins de 6 ans),Enfants (de moins de 10 ans);Matricaria chamomilla L.,Melissa officinalis L.,Valeriana officinalis L.;;;eau,maltodextrine;
DETOX KETO SLIM;J.ARMOR;Sirop;ACME SRLS;10 ML;;Les suppléments ne sont pas destinés à se substituer à une alimentation variée et équilibrée et à un mode de vie correct. Ne pas dépasser la dose journalière recommandée, tenir hors de portée des enfants de moins de 3 ans. En présence de certains états physiologiques ou pathologiques ou en association avec des thérapies pharmacologiques, consultez votre médecin. Ne pas consommer en cas d'hypersensibilité avérée à un ou plusieurs composants du produit. L’emploi est déconseillé chez les personnes sous traitement antidiabétique et anticoagulant. Il est déconseillé aux adolescents de moins de 14 ans, aux femmes enceintes ou allaitantes. Il est déconseillé de l'utiliser en dehors des repas.;;;Allaitement,Enfants (moins de 12 ans),Grossesse,Sous anticoagulants,Sous antidiabétiques;Camellia sinensis (L.) Kuntze,Carica papaya L.,Fucus vesiculosus L.,Marsdenia sylvestris (Retz.) P.I.Forst.,Opuntia ficus-indica (L.) Mill.;;;Eau purifiée,E422,fructose,Arôme,E420,E415,E330,E202,E211;
Fer Bisglycinate + B9;SFB Laboratoires;Gélule;DIFFUS EXPRESS S F B LABORATOIRES;1 gélule;Prendre une gélule par jour.;Ce produit n'est pas un médicament mais un complément alimentaire. Il ne se substitue pas à une alimentation variée et équilibrée. Il est important d'avoir un mode de vie sain. Attention : le fer est toxique à forte dose. À conserver au sec et l'abri de la lumière. Tenir hors de portée des enfants.;;;Adolescents (moins de 18 ans),Enfants (moins de 12 ans),Enfants en bas âge (1 à 3 ans),Enfants (de moins de 6 ans),Enfants (de moins de 10 ans);;;;E414,Bisglycinate ferreux,Acétate de D-alpha-tocophéryle,Acide ptéroylmonoglutamique;Grossesse et allaitement,Immunité
QUIETUDE +;Shenti;Comprimé;Phytocomm Luxembourg sàrl;18 comprimés (9g);3 x 3 à 6 comprimés par jour;;;;Enfants (moins de 12 ans);Glycyrrhiza glabra L.,Triticum aestivum L.,Ziziphus jujuba Mill.;;;;Humeur
Gorge OK;Shenti;Comprimé;Phytocomm Luxembourg sàrl;9g (3x6 compr.);3 x 3 à 6 comprimés par jour;;;;Autre (à préciser),Enfants (moins de 12 ans),Utilisation prolongée;Forsythia suspensa (Thunb.) Vahl,Gardenia jasminoides J. Ellis,Glycyrrhiza glabra L.,Mentha x piperita L.,Platycodon grandiflorus (Jacq.) A.DC.,Scutellaria baicalensis Georgi;;;;Voies respiratoires
Aubépine macérat mère;La Terre mère;Compte-gouttes;ROSTAING TAYARD CLAIRE;5 à 15 gouttes;A diluer dans un verre d'eau à jeun;Respecter les doses conseilléesNe peut se substituer à une alimentation variée et équilibréeTenir hors de la portée des enfantsConserver à l'abri de la chaleur et la lumièreUn léger dépôt est possibleEnfants, femmes enceintes et allaitantes se référer à l'avis d'un médecin ou d'un thérapeute spécialisé.;gemmothérapie;;;Crataegus laevigata (Poir.) DC.,Crataegus monogyna Jacq.;;;eau de source,Alcool,E422;Autre (à préciser),Système nerveux
PRELE BIO;MILLEGREEN;Comprimé;NATURE ET PLANTES;2 à 3 comprimés par jour;2 à 3 comprimés par jour avec un grand verre d'eau au cours des repas.;Il est recommandé de respecter les doses conseillées, de veiller à avoir une alimentation variée et équilibrée et un mode de vie sain. Tenir hors de portée des enfants. A conserver dans un endroit sec, frais et à l'abri de la lumière.;;;;Equisetum arvense L.;Equisetaceae;Parties aériennes;E504,E553b;
Collagen Peptides;NaturesPlus;Poudre;ALL4GREEN;1 cuillère doseuse / jour (10,5 g);Prendre 1 cuillère doseuse par jour à dissoudre dans de l'eau, thé, café, smoothie, yaourt, soupe;Il est recommandé aux femmes enceintes et allaitantes de consulter un professionnel de santé avant toute complémentation.;;;Autre (à préciser);;;;Collagène,Collagène hydrolysé,Acide L-ascorbique,Papaïne;Articulations,Peau
GINKGO BILOBA BIO;MILLEGREEN;Comprimé;NATURE ET PLANTES;2 à 3 comprimés par jour;2 à 3 comprimés par jour avec un grand verre d'eau au cours des repas.;Consultez votre médecin en cas de prise d'anticoagulants. L'emploi chez les personnes sous traitement antidépresseur est déconseillé, ainsi que chez les femmes enceintes et allaitantes.Il est recommandé de respecter les doses conseillées, de veiller à avoir une alimentation variée et équilibrée et un mode de vie sain. Tenir hors de portée des enfants. A conserver dans un endroit sec, frais et à l'abri de la lumière.;;;Allaitement,Grossesse,Sous anticoagulants,Sous traitement antihypertenseur;Ginkgo biloba L.;Ginkgoaceae;Feuille;maltodextrine,E504,E553b;
HELIX ORIGINAL FORTE;;Gélule;ELITE TRAD AG;1;prendre 1 gelule le matin  avec un verre d'eau;;;;Enfants (moins de 12 ans),Sous anticoagulants,Enfants (de moins de 6 ans),Enfants (de moins de 10 ans);Boswellia serrata Roxb. ex Colebr.,Curcuma longa L.;;;Escargot,Glucosamine sulfate 2 KCl,Collagène de poulet,Hyaluronate de sodium,Acide L-ascorbique,E470b,E551,maltodextrine,gélatine;Articulations
CHEVEUX ET PEAU;SURPRESA NATURAL LDA;Capsule;SURPRESA NATURAL UNIPESSOAL LDA;2 CAPSULES PAR JOUR;PRENDRE 2 CAPSULES PAR JOUR.;Ne pas dépasser la dose journalière expressément recommandée. Les compléments alimentaires ne doivent pas être utilisés comme substitut à une alimentation variée et équilibrée.Tenir hors de la portée des jeunes enfants. Consultez votre médecin avant de consommer le produit. Une alimentation variée et équilibrée et un mode de vie sain sont importants.;;;;Equisetum arvense L.,Panicum miliaceum L.,Spirulina platensis (Gomont) Geitler,Urtica dioica L.;;;E464,Cystéine,Nicotinamide,Bisglycinate de zinc,Papaïne,Bisglycinate de cuivre,Chlorhydrate de pyridoxine,Chlorhydrate de thiamine,Acide ptéroylmonoglutamique,D-biotine;Autre (à préciser),Peau
Curcuma;Reborn Nutrition;Gélule;AQEELAB;1 gélule par jour;;Les compléments alimentaires doivent être utilisés dans le cadre d’un mode de vie sain et ne pas être utilisés comme substituts d’un régime alimentaire varié et équilibré. Tenir hors de la portée des enfants. Ne pas dépasser la dose journalière recommandée. Déconseillé aux enfants, adolescents, femmes enceintes ou allaitantes et les personnes suivant un traitement anticoagulant. À conserver au frais, au sec et à l’abri de la lumière.;;;Adolescents (moins de 18 ans),Allaitement,Enfants (moins de 12 ans),Grossesse,Sous anticoagulants;Curcuma longa L.,Curcuma longa L.;;;E470b,Gélule végétale;Articulations
Onagre;COTINAT;Capsule;SELARL PARSY;4 capsules;A prendre avec un grand verre d'eau;Les compléments alimentaires ne remplacent pas une alimentation variée et équilibrée.Respecter les conseils d’utilisation. Produit destiné aux adultes. « Tenir hors de portée des jeunes enfants » L’avis d’un professionnel de santé est recommandé, pour les femmes enceintes ou allaitantes. A conserver à un endroit frais et sec, à l’abri de la lumière et la chaleur. Pas d’utilisation prolongée sans avis d’un professionnel.;;;Adolescents (moins de 18 ans),Allaitement,Enfants (moins de 12 ans),Enfants en bas âge (1 à 3 ans),Grossesse,Nourrissons (moins de 1 an),Enfants (de moins de 6 ans),Enfants (de moins de 10 ans);Oenothera biennis L.;Onagraceae;Graine (huile);gélatine,E422,E306;Autre (à préciser),Cheveux et ongles,Peau
Easy Body Skinny Waterless;QNT;Capsule;QNT s.a.;3 capsules par jour;à prendre avec un grand verre d'eau avant le coucher;Pas d’utilisation prolongée sans l’avis d’un spécialiste (maximum 6 semaines). Pas d’utilisation en cas d’insuffisance rénale. Déconseillé aux femmes enceintes. Demandez conseil à votre médecin ou pharmacien;Easy Body;;Grossesse,Insuffisance rénale,Utilisation prolongée;Juniperus communis L.,Urtica dioica L.,Taraxacum campylodes G.E.Haglund;;;gélatine,E470b,Chlorhydrate de pyridoxine;Autre (à préciser)
FitLine PowerCocktail Junior;FitLine;Poudre;PM - INTERNATIONAL FRANCE;7 g;Dissoudre environ 2 cuillères à café (7 g) dans 150 ml d’eau plate.;Ne pas dépasser la dose quotidienne recommandée indiquée. Les compléments alimentaires ne doivent pas remplacer un régime alimentaire varié et équilibré et un mode de vie sain. Tenir hors de portée des jeunes enfants. Ne pas utiliser chez les femmes enceintes ou allaitantes. Pas d’utilisation prolongée sans avis d’un spécialiste. Consultez votre médecin ou votre pharmacien en cas d’usage concomitant d’anticoagulants. Pour les personnes en hypothyroïdie ou ayant un traitement de la thyroïde, consultez votre médecin. Convient aux enfants à partir de 4 ans. Ne pas prendre en dehors des repas.;;Orange;Allaitement,En dehors des repas,Enfants en bas âge (1 à 3 ans),Grossesse,Nourrissons (moins de 1 an),Sous anticoagulants,Sous traitement pour la thyroïde,Utilisation prolongée;"Acacia senegal (L.) Willd.,Aronia melanocarpa (michx.) Elliot,Brassica oleracea L.,Camellia sinensis (L.) Kuntze,Cinnamomum cassia (Nees &amp; T.Nees) J.Presl,Curcuma longa L.,Daucus carota L.,Lycopersicon esculentum Mill.,Malpighia glabra L.,Malus domestica Borkh,Ocimum basilicum L.,Origanum vulgare L.,Prunus avium (L.) L.,Ribes nigrum L.,Rubus fruticosus L.,Rubus idaeus L.,Sambucus nigra L.,Spinacia oleracea L.,Vaccinium angustifolium Aiton,Vaccinium myrtillus L.";;;D-biotine,D-pantothénate de calcium,Acétate de DL-alpha-tocophéryle,Acide L-ascorbique,E330,Acide ptéroylmonoglutamique,Arôme naturel,Béta-carotène,Chlorhydrate de pyridoxine,Chlorhydrate de thiamine,Cholécalciférol,Cyanocobalamine,dextrose,fructose,Gamma-cyclodextrine,Gluconate de cuivre,Gluconate de zinc,E960,Lactate de calcium,Levure enrichie en sélénium,Nicotinamide,Riboflavine,Carbonate de magnésium;
Extrait de spiruline titré en phycocyanine aromatisé à la pomme;Sea Simple;Ampoule;TINCTURA;20 mL;à boire;Un complément alimentaire ne doit pas se substituer à une alimentation variée et équilibrée, et à un mode de vie sain.Ne pas dépasser la dose journalière recommandée.Déconseillé chez l’enfant. Tenir hors de portée des jeunes enfants.;Marine;;Enfants (moins de 12 ans);Spirulina platensis (Gomont) Geitler;Spirulinaceae;Plante entière;Eau purifiée,Arôme - pomme;Immunité
GOLD SEX MAN;;Gélule;ALP DISTRIBUTION;UNE GELULE;PRENDRE UNE GELULE PAR JOUR;Il est déconseillé de dépasser la dose journalière recommandée. L’utilisation de ce complément alimentaire ne doit pas se substituer à une alimentation diversifiée et à un mode de vie sain. Tenir hors de portée des enfants. Produit déconseillé chez les femmes enceintes et allaitantes, chez les enfants et adolescents et les personnes sous traitement antidépresseur, ou antidiabétique, ou anti-hypertenseur.;;;Adolescents (moins de 18 ans),Allaitement,Enfants (moins de 12 ans),Grossesse,Sous antidépresseurs,Sous antidiabétiques,Sous traitement antihypertenseur,Enfants (de moins de 6 ans),Enfants (de moins de 10 ans);"Panax ginseng C.A.Mey.,Syzygium aromaticum (L.) Merr. &amp; L.M.Perry,Crocus sativus L.,Terminalia chebula Retz.,Tribulus terrestris L.";;;Arginine,Taurine,Gluconate de zinc,Sélénite de sodium,Gélule végétale;Tonus sexuel
Platane;Aux Sources de la Nature;Compte-gouttes;CLEMENCON CORINNE  PATRICIA;15 gouttes;Pur ou dilué dans un peu d'eau, en dehors des repas, en une ou plusieurs prises, pendant 21 jours;Ne pas dépasser les doses conseillées. Ne peut se substituer à une alimentation variée et équilibrée. Tenir hors de portée des enfants. Agiter avant emploi.;Macérat-mère de bourgeons frais;;Allaitement,Enfants en bas âge (1 à 3 ans),Grossesse,Nourrissons (moins de 1 an);Platanus orientalis;Platanaceae;Bourgeon;Alcool,miel;Peau
Sleep Drops;foodspring;Compte-gouttes;foodspring GmbH;0,5 ml;REMPLIR LA PIPETTE (SOIT 0,5 ml). CONSOMMER DIRECTEMENT OU BIEN DILUER DANS 50 ml D‘EAU.;LES COMPLÉMENTS ALIMENTAIRES NE REMPLACENT NI UNE ALIMENTATION VARIÉE ET ÉQUILIBRÉE, NI UN MODE DE VIE SAIN. ATTENTION À NE PAS DÉPASSER LA DOSE QUOTIDIENNE RECOMMANDÉE QUI EST INDIQUÉE. À TENIR HORS DE PORTÉE DES JEUNES ENFANTS. CONTIENT DE L‘ALCOOL (MOINS DE 1% VOL).;;Lavande;Adolescents (moins de 18 ans),Allaitement,Enfants (moins de 12 ans),Enfants en bas âge (1 à 3 ans),Grossesse,Nourrissons (moins de 1 an),Utilisation prolongée,Enfants (de moins de 6 ans),Enfants (de moins de 10 ans);Lavandula angustifolia Mill.;Lamiaceae;Fleur;E330,Mélatonine,E202;Sommeil
Glycin 1 kg;Vegavero;Poudre;Vanatari International GmbH;1,5 g par jour;Mélanger 1,5 g de poudre une fois par jour;Les compléments alimentaires ne se substituent pas à une alimentation saine et variée ni à un exercice physique régulier. Ne pas dépasser la dose journalière indiquée. Tenir hors de portée des enfants. Conserver dans un endroit sombre, frais et sec.;;;;;;;Glycine;Système nerveux
EXTRAIT DE PÉPINS DE PAMPLEMOUSSE (50ML);BONESCIENT;Compte-gouttes;RELAIS VERT;10 gouttes, 3 fois par jour;;À consommer de préférence avant ?n : Voir au fond.•A conserver au réfrigérateur après ouverture.•Ne pas dépasser la dose journalière recommandée. •A utiliser de le cadre d’une alimentation équilibrée.•Tenir hors de portée des enfants.;;;;Citrus paradisi Macfad.;Rutaceae;Pépin;;
