NomCommercial;Marque;FormeGalenique;ResponsableEtiquetage;DoseJournaliere;ModeEmploi;MisesEnGarde;Gamme;Aromes;population_a_risques;plantes;familles_plantes;parties_plantes;autres_ingredients;objectif_effet
HARPAGOPHYTUM BIO;ELFIA NATURE;Comprimé;SAS ELFIA NATURE;3;A utiliser dans le cadre d'une alimentation équilibrée;"Ne pas dépasser la dose journalière recommandée.
L'emploi est déconseillé aussi en cas de calculs biliaires";;;Ulcère (estomac ou duodenum);Harpagophytum procumbens;Pedaliaceae;Racine;Carbonate de magnésium,E553b;
GUARANA BIO;ELFIA NATURE;Comprimé;SAS ELFIA NATURE;3;A utiliser dans le cadre d'une alimentation équilibrée;"Ne pas dépasser la dose journalière recommandée.
ce produit contient de la caféine.";;;;Paullinia cupana Kunth;Sapindaceae;Graine;Carbonate de magnésium,E551;
SOMMEIL;;Comprimé;RIVADIS HOLDING;2 comprimés;2 comprimés le soir, avec un grand verre d’eau, 1h heure avant le coucher.;"Ne pas utiliser en cas de grossesse ou d’allaitement, ne pas utiliser en cas de traitement hypertenseur.
Ne pas administrer à des enfants de moins de 12 ans.
Cesser l’utilisation du produit en cas d’agitation ou de nervosité.";CHRONO BEAUTE;;Allaitement,Enfants (moins de 12 ans),Grossesse,Sous traitement antihypertenseur;Citrus aurantium L.,Crataegus laevigata (Poir.) DC.,Humulus lupulus L.,Passiflora incarnata L.;;;E414,E460,E470b,Mélatonine;Sommeil
Natural Calm Magnésium;;Poudre;Pradeep Hoogakker;3g;1 cuillère-mesure (3g) par jour. Mettez la poudre dans un verre d'eau [...] froide.;;;;;;;;Sels de magnésium de l'acide citrique;Autre (à préciser),Système nerveux
CHLORELLA;GPH DIFFUSION;Gélule;GPH DIFFUSION;3;A utiliser dans le cadre d'une alimentation équilibrée;Ne pas dépasser la dose journalière recommandée;;;;Chlorella vulgaris Beijerinck;Chlorellaceae;Thalle;E464;
Fonction Musculaire Relaxation;;Gélule;DAYANG;3;Prendre 3 gélules par jour en une seule prise avec un grand verre d’eau pendant 5 à 10 jours.;"La curcumine possède des effets inhibiteurs sur l’agrégation plaquettaire.
Déconseillée aux personnes sous anticoagulants, aux personnes souffrant d’allergie aux dérivés salicylés, aux enfants et aux adolescents.";;;Adolescents (moins de 18 ans),Allergie aux dérivés salicylés,Enfants (moins de 12 ans),Sous anticoagulants;Salix alba L.,Valeriana officinalis L.;;;Carbonate de calcium,E464,Citrate de potassium,Oxyde de magnésium,Ubiquinone,Curcumine,Cyanocobalamine,Cholécalciférol,Chlorhydrate de thiamine;Sport
Complexe So08;Nutri Prescription Paris;Gélule;PHARMAVANCE GROUPEMENT;2 gélules par jour;Prendre 1 gélule matin et soir pendant le repas.;Recommandations : ce produit ne doit pas se substituer à une alimentation diversifiée et équilibrée, et à un mode de vie sain. Ne dispense pas de l’application d’une protection locale lors de périodes d’exposition solaire. Respecter les conseils d'utilisation, la dose journalière conseillée et la date limite d'utilisation. Déconseillé aux femmes enceintes ou allaitantes, et aux enfants de moins de 15 ans, sauf avis médical contraire. Tenir hors de portée des jeunes enfants. A conserver dans un endroit sec et frais.;;;Allaitement,Enfants (moins de 12 ans),Grossesse;;;;Acide L-ascorbique,Acétate de D-alpha-tocophéryle,Lycopène,Nicotinamide,E551,Rétinol,Sulfate de cuivre,Sélénite de sodium,Gélule végétale,Huile de Schizochytrium sp;Solaire
Acti Flore;;Gélule;ITAYO;1 gélule;;;;;;;;;gélatine;
Confort urinaire bio;;Gélule;FLORALPINA;6 gélules;Jusqu'à 6 gélules par jour;;;;Enfants (moins de 12 ans);Foeniculum vulgare Mill.,Vaccinium macrocarpon Aiton;;;;Système urinaire
Hair&Nails Beauty;;Gélule;IRATI INTERNATIONAL;1 capsule + 1 gélule / jour;Prendre 1 capsule molle et 1 gélule par jour avec un grand verre d’eau.;;;;;Triticum aestivum L.,Equisetum arvense L.;;;gélatine,E422,D-alpha-tocophérol,Mélange de tocophérols,E304,E310,maltodextrine,Kératine,E470b,Sulfate de cuivre,D-biotine;Cheveux et ongles
BOOSTE L'ENERGIE;GERIMAX;Flacon;Orkla Care A/S;60 ml;à boire;;;cola - citron vert;Allaitement,Enfants (moins de 12 ans),Enfants en bas âge (1 à 3 ans),Grossesse,Hypertension,Nourrissons (moins de 1 an),Sous anticoagulants,Sous antidiabétiques,Utilisation prolongée;Panax ginseng C.A.Mey.,Paullinia cupana Kunth;;;eau,saccharose,glucose,Arôme,E202,E330,E950,E959;Autre (à préciser),Concentration,Sport
VIRILITY + FOR MEN;;Gélule;IRATI INTERNATIONAL;4 gélules / jour;Prendre 1 à 4 gélules avec un grand verre d’eau, de préférence 30 minutes à 1 heure avant l’acte cha;L’emploi chez les femmes enceintes et allaitantes, chez les enfants et adolescents ou en cas de traitement anti-hypertenseur, antidiabétique ou anti-dépresseur est déconseillé.;;;Adolescents (moins de 18 ans),Allaitement,Enfants (moins de 12 ans),Enfants en bas âge (1 à 3 ans),Grossesse,Nourrissons (moins de 1 an),Sous antidépresseurs,Sous antidiabétiques,Sous traitement antihypertenseur;Zingiber officinale Roscoe,Panax ginseng C.A.Mey.,Urtica dioica L.,Crocus sativus L.,Tribulus terrestris L.,Vitis vinifera L.;;;Oxyde de magnésium,gélatine,E171,E172,amidon de maïs,Taurine,E470b,Oxyde de zinc;Tonus sexuel
AIL;;Gélule;SYLVIE CARDON;6 gélules;6 gélules par jour;;;;;Allium sativum L.;Amaryllidaceae;Bulbe;E464;
Complexe antioxydant;;Gélule;SYLVIE CARDON;2 gélules;2 gélules par jour;Contient de la caféine.;;;Adolescents (moins de 18 ans),Allaitement,En dehors des repas,Enfants (moins de 12 ans),Grossesse;Euterpe oleracea Mart.,Malpighia glabra L.,Camellia sinensis (L.) Kuntze,Vitis vinifera L.;;;maltodextrine,E464;Antioxydant
TRIKATU BIO;;Gélule;AYUSHKAR DIFFUSION;4 gélules par jour;Prendre 1 à 2 gélules 2 fois par jour avec un grand verre d’eau;Déconseillé aux enfants de moins de 6 ans, femmes enceintes ou allaitantes.;;;Allaitement,Enfants en bas âge (1 à 3 ans),Grossesse,Nourrissons (moins de 1 an);Zingiber officinale Roscoe,Piper longum L.,Piper nigrum L.;;;Hydroxypropyl Méthyl Cellulose;Digestion
Ergyox;;Gélule;bioserum laboratorios S.L.;1 gélule;Prendre une gélule par jour.;"Complément alimentaire
Conserver dans un endroit sec et frais.
Il est déconseillé de dépasser la dose journalière indiquée.
Les compléments alimentaires ne doivent pas être utilisés comme substituts d'un régime alimentaire varié.
Maintenir loin de la portée des enfants.";;;;Theobroma cacao L.,Punica granatum L.,Reynoutria japonica Houtt.,Sedum roseum (L.) Scop.,Vitis vinifera L.;;;Acide L-ascorbique,DL-alpha-tocophérol,Gluconate de zinc,Picolinate de chrome,L-sélénométhionine,Ubiquinone,E460,E470b,gélatine;Antioxydant
FENOUIL;SPN;Gélule;GPH DIFFUSION;3 gélules;A utiliser dans le cadre d'une alimentation équilibrée;Ne pas dépasser la dose journalière recommandée;;;Enfants (moins de 12 ans);Foeniculum vulgare Mill.;Apiaceae;Semence;E422,gélatine;
GUARANA;SPN;Gélule;GPH DIFFUSION;3;A utiliser dans le cadre d'une alimentation équilibrée;Ne pas dépasser la dose journalière recommandée;;;;Paullinia cupana Kunth;Sapindaceae;Semence;gélatine,E422;
Harpagophytum bio;;Gélule;IBSY;3 à 5 gélules;3 à 5 gélules par jour, à répartir dans la journée avant les repas.;Déconseillé en cas d'ulcères ou de calculs biliaires.;;;;Harpagophytum procumbens;Pedaliaceae;Racine;huile de tournesol,gélatine,Hydroxypropyl Méthyl Cellulose,E551;Articulations
Magnesium 500;Be-Life;Gélule;Bio-Life SPRL;1 à 3 gélules par jour;à consommer avec un verre d'eau;"Ne se substitue pas à une alimentation variée et équilibrée ni à un mode de vie sain. 
A consommer avec un verre d’eau. 
Ne pas dépasser la dose maximale. 
Conserver au sec et hors de portée des enfants.";Minéraux;;;;;;Bisglycinate de magnésium,Hydroxypropyl Méthyl Cellulose;Autre (à préciser)
Magnesium Magnum;Be-Life;Gélule;Bio-Life SPRL;1 à 3 gélules par jour;à consommer avec un verre d'eau;"Ne se substitue pas à une alimentation variée et équilibrée ni à un mode de vie sain. 
A consommer avec un verre d’eau. 
Ne pas dépasser la dose maximale. 
Conserver au sec et hors de portée des enfants.";minéraux;;;;;;Bisglycinate de magnésium,E470b,Hydroxypropyl Méthyl Cellulose;Autre (à préciser)
Tonique;VITAKIDS;Flacon;LABORATOIRES LARUNE;15 ml / jour;Agiter avant emploi. Prendre 1 cuillère à soupe par jour, pure ou diluée dans un verre d’eau ou un j;Déconseillé aux personnes sous traitement antidiabétique.;;;Sous antidiabétiques;Malpighia glabra L.,Panax ginseng C.A.Mey.,Hibiscus sabdariffa L.;;;Eau purifiée,miel,jus de fruits,Jus de cassis,Arômes,Gelée royale lyophilisée,Acide L-ascorbique,E202,E212,Sels de magnésium de l'acide citrique;Autre (à préciser)
BEAUTE BIO;;Comprimé;OLIVIER PETIT;4 comprimés;2 le matin et 2 le soir;;;;;Borago officinalis L.,Daucus carota L.,Viola tricolor L.,Vitis vinifera L.;;;Fibres solubles d''acacia,E551;Peau
spiruline;;Comprimé;MONSIEUR MIGUEL CAMPOY;8;A avaler le matin ou dans la journée, avec un verre d'eau ou un jus de fruits;;;;;Spirulina platensis (Gomont) Geitler;Spirulinaceae;Plante entière;;Immunité
COMPLEX DAILY;;Gélule;N4BRANDS;1;;;VEGAN SPORT;;;;;;E460,E464,Ergocalciférol,Levure enrichie en sélénium,Cyanocobalamine,E470b,E551,Iodure de potassium,E171;
QNT NO+ Elite;QNT (Quality Nutrition Technology);Poudre;QNT s.a.;30g;Mélanger quotidiennement 30g avec 600ml d'eau avant l'entraînement. A ne pas dépasser;;MAS;citron;Allaitement,Enfants (moins de 12 ans),Enfants en bas âge (1 à 3 ans),Grossesse,Nourrissons (moins de 1 an);;;;dextrose,maltodextrine,Chlorhydrate de L-arginine,Monohydrate de créatine,L-Glutamine,E341,E551,Bêta-alanine,Taurine,E330,Arôme,L-Ornithine HCL,Chlorhydrate d''acétyl-L-carnitine,Caféine,E955,E950,Acide L-ascorbique;Sport
CALCIUM;SOFINNOV;Gélule;NUTRORGANIC S.L.;4 gélules;2 à 4 gélules le matin;;CARENCES;;;;;;Oxyde de magnésium,E341,Hydroxypropyl Méthyl Cellulose,Carbonate de calcium,Carbonate de magnésium,E470b,E551;Croissance et developpement
ERBASTIM;ERBALAB;Gélule;ERBALAB;1 à 2 gélules par jour;voie orale;Précautions d’utilisation : Ne pas dépasser la dose journalière recommandée. Tenir hors de portée des jeunes enfants. Ce complément alimentaire ne se substitue pas à une alimentation variée et équilibrée ni à un mode de vie sain. Ce produit est déconseillé aux enfants de moins de 6 ans, aux femmes enceintes ou allaitantes. Demander conseil à un pharmacien ou à un médecin. Ne convient pas aux personnes allergiques à l’un des constituants.;Immunité;;Allaitement,Enfants en bas âge (1 à 3 ans),Grossesse;"Euterpe oleracea Mart.,Melaleuca alternifolia (Maiden &amp; Betche) Cheel,Alnus glutinosa (L.) Gaertn.,Ribes nigrum L.,Chlorella vulgaris Beijerinck,Cinnamomum camphora (L.) J. Presl,Echinacea purpurea (L.) Moench,Abies alba Mill.,Sambucus nigra L.";;;E553b;Immunité
CUIVRE;LABORATOIRES FENIOUX;Comprimé;LABORATOIRES FENIOUX PLANTES MEDICINAL;1comprimé par jour;1 comprimé par jour 10 minutes avant un repas avec un grand verre d’eau;;;;;;;;E460,E341,Bisglycinate de cuivre,E470b;Antioxydant
N° 14 Heather;herba-elixir;Flacon;LEMON PHARMA FRANCE SARL;6 gouttes;verser 3 gouttes dans un verre d'eau, 2 fois par jour;;;;Enfants (moins de 12 ans),Enfants en bas âge (1 à 3 ans),Grossesse,Nourrissons (moins de 1 an);Calluna vulgaris (L.) Hull;Ericaceae;Fleur;Cognac;
N° 30 Sweet Chestnut;herba-elixir;Flacon;LEMON PHARMA FRANCE SARL;6 gouttes;verser 3 gouttes dans un verre d'eau, 2 fois par jour;;;;Enfants (moins de 12 ans),Enfants en bas âge (1 à 3 ans),Grossesse,Nourrissons (moins de 1 an);Castanea sativa Mill.;Fagaceae;Fleur;Cognac;
BCAA 20:1:1;;Poudre;Olimp Laboratories. Sp. z o.o.;2 portions (14,4g);Prendre 1 - 2 portions par jour. Ajouter une portion (7,2g de la poudre = 1 dosette) à 200 ml d'eau.;Le produit n'est pas recommandé pour les enfants, les femmes enceintes et les femmes allaitantes.;;Poire;Allaitement,Enfants (moins de 12 ans),Enfants en bas âge (1 à 3 ans),Grossesse,Nourrissons (moins de 1 an);;;;L-isoleucine,L-leucine,L-valine,Citrulline,E330,Arômes,Citrate de sodium,Oxyde de magnésium,E950,E955,E322,Bisglycinate de zinc,Chlorhydrate de pyridoxine;Sport
OPTIFLORUS® KIDS;LABORATOIRES FENIOUX;Sachet;LABORATOIRES FENIOUX PLANTES MEDICINAL;1 sachet par jour;1 sachet par jour le soir au coucher;Destiné aux enfants de 4 à 8 ans;;;;;;;maltodextrine,Fructo-oligosaccharides,Amidon de pomme de terre;Transit
HYALURMED;;Flacon;PHARMA FSC LTD;1 ml;Diluez 1 ml (12 gouttes) [...] votre médecin traitant.;;;;;;;;E422,Eau purifiée,Acide hyaluronique,E338,E211,E202;Articulations,Peau
RESPILIBRE®;LABORATOIRES FENIOUX;Comprimé;LABORATOIRES FENIOUX PLANTES MEDICINAL;4 comprimés par jour;1 à 2 comprimés matin et soir à laisser fondre sous la langue;Une consommation excessive peut avoir des effets laxatifs;;;;;;;E420,E460,E470b,Bisglycinate de zinc,Poudre d'œuf de caille;Immunité
macérat glycériné concentré de bouleau;;Compte-gouttes;MONSIEUR MICHAEL BOUSQUET;15 gouttes;;;;;;Betula pendula Roth;Betulaceae;Bourgeon;E422,Alcool éthylique,Eau purifiée;Détoxifiant / Draineur
macérat glycériné concentré de ginkgo;;Compte-gouttes;MONSIEUR MICHAEL BOUSQUET;15 gouttes;;;;;Sous anticoagulants,Sous antidépresseurs;Ginkgo biloba L.;Ginkgoaceae;Jeune pousse;E422,Alcool éthylique,Eau purifiée;Circulation sanguine et lymphatique
Vitnat;Be-Life;Gélule;Bio-Life SPRL;1 à 2 gélules par jour;à consommer avec un verre d'eau;"Ne se substitue pas à une alimentation variée et équilibrée ni à un mode de vie sain.
A consommer avec un verre d’eau.
Ne pas dépasser la dose maximale. 
Suivant avis médical en cas d'usage d'anticoagulant.
Conserver au sec et hors de portée des enfants.";Vitamines;;Sous anticoagulants;Malpighia glabra L.,Auxenochlorella pyrenoidosa (H.Chick) Molinari & Calvo-Pérez,Curcuma longa L.,Spirulina platensis (Gomont) Geitler;;;L-ascorbate de calcium,Béta-carotène,Ubiquinone,D-alpha-tocophérol,Hydroxypropyl Méthyl Cellulose;Autre (à préciser),Immunité
ECHINACEE;REMEDE NATUREL;Gélule;REMEDE NATUREL SAS;3;A utiliser dans le cadre d'une alimentation équilibrée;Ne pas dépasser la dose journalière recommandée;;;;Echinacea purpurea (L.) Moench;Compositae;Racine;E464;
Boost Ginseng de Sibérie Guarana Vitamine C;Laboratoires Juvamine;Sachet;LABORATOIRES JUVA SANTE;1 stick;Stick orodispersible à avaler sans eau;Une consommation excessive peut avoir des effets laxatifs;;Orange sanguine;Enfants (moins de 12 ans),Grossesse;Eleutherococcus senticosus (Rupr. et Maxim.) Maxim,Paullinia cupana Kunth;;;Acide L-ascorbique,arôme - orange,E420,glucose,Arôme,E955;Autre (à préciser)
Huile essentielle Clémentine;;Compte-gouttes;PHARMACIE PERE BLAIZE;6 gouttes;1 à 2 gouttes par jour. Ne pas avaler l’huile essentielle pure.;Les compléments alimentaires ne peuvent pas être utilisés comme substituts d’un régime alimentaire équilibré et varié, et d’un mode de vie sain. Déconseillé en cas de grossesse ou allaitement et chez l’enfant de moins de 6 ans. Conserver à l'abri de l'air, de la chaleur et de la lumière. Ne pas dépasser la dose journalière recommandée. Tenir hors de portée des enfants.;;;Allaitement,Autre (à préciser),Enfants en bas âge (1 à 3 ans),Grossesse,Nourrissons (moins de 1 an);Citrus reticulata Blanco;Rutaceae;Essence (épicarpe,zeste);;
Aloe-SY GOÛT DE FRUIT;Syrio;Flacon;Syrio;50 ml par jour;50 ml • (1 mesure) par jour. Ne pas dépasser les doses indiquées.;"Ne pas dépasser la dose journalière conseillée. Conserver hors de la portée des enfants de moins de
trois ans. Les compléments alimentaires ne doivent pas être considérés comme des substituts à un régime varié,
équilibré et à un style de vie sain. Ne pas utiliser le produit en cas d'hypersensibilité avérée envers un ou plusieurs
des composants. Ne pas administrer aux enfants de moins de 12 ans. Demandez conseil à votre médecin
pendant la grossesse ainsi qu'en cas d'allaitement. Ne pas utiliser pendant des périodes prolongées sans
consulter un médecin. Toute légère variation de la couleur du produit peut être attribuée aux ingrédients
naturels contenus et n'indique pas une altération de la qualité du produit. La quantité de dérivés
anthracéniques exprimés en barbaloïne ne doit pas dépasser la dose pharmacologique (10 mg).";;pêche;Allaitement,Enfants (moins de 12 ans),Enfants en bas âge (1 à 3 ans),Grossesse;Aloe vera (L.) Burm. f.;Asparagaceae;Feuille (gel);Arômes,E330,E338,E211,E202,E955;Détoxifiant / Draineur,Digestion,Transit
citrus reticulata aetheroleum;My Comsetik;Flacon;EKO FRIENDLY;2 gouttes 3x/j;2 gouttes 3x/j;;;;Allaitement,Enfants en bas âge (1 à 3 ans),Grossesse,Nourrissons (moins de 1 an);Citrus reticulata Blanco;Rutaceae;Essence (épicarpe,zeste);;
Phyto-Bioactif Sommeil;;Flacon;DIETANAT;3 cuillère à café;1 cuillerée à café dans un verre d'eau, 3 fois par jour pendant les repas;Déconseillé aux enfants de moins de 12 ans.;;;Enfants (moins de 12 ans);Eschscholzia californica Cham.,Melissa officinalis L.,Papaver rhoeas L.,Passiflora incarnata L.,Tilia tomentosa Moench,Valeriana officinalis L.;;;Eau purifiée,E422,Alcool éthylique,miel;Sommeil
Rosmarinus officinalis CT cinéole aetheroleum;My Cosmetik;Flacon;EKO FRIENDLY;2 gouttes 3x/j;2 gouttes 3x/j. Ne pas utiliser pure, sans support ni mélangée à de l'eau.;;;;Allaitement,Autre (à préciser),Enfants en bas âge (1 à 3 ans),Grossesse,Hypertension,Nourrissons (moins de 1 an),Utilisation prolongée;Rosmarinus officinalis L.;Lamiaceae;Essence (sommités fleuries);;
BCAA + B6;Biotech USA;Comprimé;BioTechUSA Kft.;4 comprimés;Prendre 4 comprimés par jour. Prendre 2 comprimés 30 minutes avant et 2 après l'entrainement;;Biotech USA;;;;;;L-leucine,L-isoleucine,L-valine,Chlorhydrate de pyridoxine,E322,E1203,E1209,E171,E553b,E460,E470b,E551;Sport
Levure 80 mg Enfant;;Sachet;L P R;2 sachets par jour;2 sachets par jour, en une seule prise, à mélanger dans une boisson (lait, eau) ou un aliment adapté;;;;;;;;lactose;Digestion
VITALFLAX;;Capsule;LUBERON TECHNOLOGIES LABO;1 à 4 capsules selon l'age;A avaler ou à percer pour les plus jeunes enfants;;;;Antécédent de cancer du sein,Autre (à préciser),Enfants en bas âge (1 à 3 ans),Nourrissons (moins de 1 an);Linum usitatissimum L.;Linaceae;Graine (huile);Mélange de tocophérols,Gélatine de poisson,E422;Croissance et developpement,Humeur,Mémoire
Ginkgo Biloba + Lecithin;BioTech USA;Gélule;BioTechUSA Kft.;1 gélule;Prendre 1 gélule par jour avec un grand verre d’eau.;;BioTech USA;;Allaitement,Grossesse,Sous anticoagulants;Ginkgo biloba L.,Glycine max. (L.) Merr.;;;gélatine,E422,huile de soja,DL-alpha-tocophérol,E901,E172;Sport
Magnésium Marin+ Vitamine B6;NUTRIMEA;Gélule;Plastimea;2 gélules;1gel/jour entre 30min et 1h avt le coucher ac 1 verre d’eau. après le diner. 2 en cas de besoin;;;;;;;;Oxyde de magnésium,E464,Chlorhydrate de pyridoxine,E551;Autre (à préciser),Système nerveux
BCAA 2.1.1;NUTRYTEC;Poudre;NUTRYTEC LABORATORIOS, S.A.;10 g;Prendre 5 g du produit (1 coupelle doseuse de 5 ml abondante), seul ou avec liquide, 1 heure avant d;;MUSCLEGENIX;NEUTRE;;;;;L-leucine,L-isoleucine,L-valine,Chlorhydrate de pyridoxine;Sport
DRENA+;NUTRYTEC;Flacon;NUTRYTEC LABORATORIOS, S.A.;40 ml;Prendre 20 ml (1 bouchon jusqu’à la marque de 20 ml) deux fois par jour. Prendre directement ou dilu;Tartrazine peut avoir des effets indésirables sur l´activité et l´attention chez les enfants. Il est déconseillé leur prise en dehors des repas, ainsi que leur consommation par les enfants, les adolescents, les femmes enceintes ou allaitantes. Il est déconseillé l’emploi aux personnes souffrant d’allergie aux dérivés salicylés. L’emploi chez les personnes sous traitement anti-coagulant est déconseillé.;3XL HERS;ANANAS;Adolescents (moins de 18 ans),Allaitement,Allergie aux dérivés salicylés,Autre (à préciser),En dehors des repas,Enfants (moins de 12 ans),Grossesse,Sous anticoagulants;Ananas comosus (L.) Merrill,Ananas comosus (L.) Merrill,Camellia sinensis (L.) Kuntze,Camellia sinensis (L.) Kuntze,Filipendula ulmaria (L.) Maxim.;;;eau,Inuline,E330,Arôme - ananas,arôme - citron,E211,E202,E955,E950,E150d,E102;Sport
SYMBIFEROL;LISARCE;Gélule;LABORATOIRES LISARCE;1 gélule par jour;;;;;Enfants (moins de 12 ans);;;;Gélule végétale,Lactoferrine,Acide ptéroylmonoglutamique,Cholécalciférol,Bisglycinate ferreux;
Desmodium;;Ampoule;PHARM & NATURE;1 ampoule de 10 ml;1 ampoule par jour diluée dans un verre d'eau;Les compléments alimentaires doivent être utilisés dans le cadre d'un mode de vie sain et ne pas être utilisés comme substituts d'un régime alimentaire varié et équilibré. Garder le produit hors de la portée des jeunes enfants.Ne pas dépasser la dose journalière recommandée.;;;;Desmodium adscendens (Sw.) DC.;Leguminosae;Feuille;;Détoxifiant / Draineur
Huile essentielle;;Compte-gouttes;LABO AROMA PHYTO HERB TRAD PHYTOFRANCE;4 gouttes;1 à 2 gouttes par prise, 1 à 2 fois par jour, dans une cuillère à café d'huile végétale ou de miel;;;;Autre (à préciser),Enfants (moins de 12 ans),Enfants en bas âge (1 à 3 ans),Grossesse,Nourrissons (moins de 1 an);Illicium verum Hook.f.;Schisandraceae;Fruit;;
Préventus;;Comprimé;COMPAGNIE GENERALE DE DIETETIQUE;2 à 4 dragées par jour;;;;;;;;;saccharose,hydrolysat de poisson,E341,maltodextrine,E553b,Fructo-oligosaccharides,E904,E1201,E471,Dioxyde de silicium,E901,Chlorhydrate de pyridoxine,E903;Autre (à préciser)
Gélule Renouée du Japon;HERBIER DU VELAY;Gélule;VECTEUR ENERGY;6;prendre 1 à 2 gélules (3 fois par jour) pendant le repas avec un verre d'eau;"Déconseillé l'emploi aux enfants de moins de 12 ans, femmes enceintes ou allaitantes.
Déconseillé l'usage prolongé.";Gélules;;Allaitement,Enfants (moins de 12 ans),Grossesse,Utilisation prolongée;Reynoutria japonica Houtt.,Reynoutria japonica Houtt.;;;Hydroxypropyl Méthyl Cellulose;Antioxydant,Articulations,Circulation sanguine et lymphatique,Immunité
Somnidryne;Eric Favre;Comprimé;LES TROIS CHENES;2;Prendre 2 comprimés le soir au coucher;;;;Allaitement,Grossesse,Sous antidépresseurs;Griffonia simplicifolia (DC.) Baill.,Melissa officinalis L.,Eschscholzia californica Cham.;;;Oxyde de magnésium,Chlorhydrate de pyridoxine,Nicotinamide,Mélatonine,E460,E551,E470b,Arôme naturel;Sommeil
HYDROLAT DE ROSE CENTIFOLIA BIO;;Flacon;DISTILLERIE LUEUR DU SUD;1 cuillère à café (5 mL);1 cuillère à café dans un verre d'eau 1 fois par jour;A réserver au frigidaire après ouverture.;;;;Rosa centifolia L.;Rosaceae;Fleur;;
Gingembre Bio;Pharm&Nature;Gélule;PHARM & NATURE;3 à 6 gélules;Prise conseillée avec un verre d'eau;;;;Grossesse;Zingiber officinale Roscoe;Zingiberaceae;Rhizome;;Autre (à préciser)
BAMBOU TABASHIR;Phyto Nutriments System;Gélule;PHYTO NUTRIMENTS SYSTEM;600 mg;1 à 2 gélules par jour;"Ne pas dépasser la dose indiquée.
Conserver le produit à l'abri de la lumière, de la chaleur et de l'humidité.
Un complément alimentaire ne doit pas se substituer à une alimentation variée et équilibrée et à un mode de vie sain.
Tenir hors de portée des jeunes enfants.";;;;Bambusa bambos (L.) Voss;Poaceae;Exsudat;;Articulations,Os
RESTORE - RX;Nutrytec;Poudre;NUTRYTEC LABORATORIOS, S.A.;15 g;Prenez 2 coupelles doseuses de produit (7.5 g) avant et après l’entrainement;E-122 peut avoir des effets négatifs sur l'activité et l'attention chez les enfants.;Iron Muscle;Fruits;Autre (à préciser);;;;Glutamine,dextrose,Leucine,Isoleucine,Valine,E330,E954,E955,Chlorhydrate de pyridoxine,arôme - fraise,arôme - fruit des bois,E122,E551,Arôme - framboise,Poudre de fraise;Sport
DRAINEUR FRUITS ROUGES;ACTIF BIEN ETRE;Flacon;ACTIF BIEN ETRE;30 ml;2 bouchons doseurs par jour à diluer dans l’eau;"Les compléments alimentaires ne se substituent pas à une
alimentation variée et équilibrée.
- Ne pas dépasser la dose journalière recommandée.
- Tenir à l’abri de la chaleur et de l’humidité.
- Tenir hors de portée des enfants.
- Contient de la caféine (5mg) déconseillée aux enfants,
adolescents, aux femmes enceintes et allaitantes
- déconseillé aux personnes souffrant d’allergies
aux dérivés salicylés.
- Ne pas consommer en dehors des repas.";MINCEUR;fruits rouges;Adolescents (moins de 18 ans),Allaitement,Allergie aux dérivés salicylés,Enfants (moins de 12 ans),Enfants en bas âge (1 à 3 ans),Grossesse;Betula pendula Roth,Camellia sinensis (L.) Kuntze,Prunus avium (L.) L.,Cynara scolymus L.,Elymus repens (L.) Gould,Fraxinus excelsior L.,Ilex paraguariensis A. St.-Hil.,Raphanus raphanistrum subsp. sativus (L.) Domin,Filipendula ulmaria (L.) Maxim.,Taraxacum campylodes G.E.Haglund;;;Eau purifiée,E202,E211,E330,E300,E950,E422,Jus de cassis,Arôme - fruit rouge;Détoxifiant / Draineur
ANABOLIC BCAA SYSTEM;;Comprimé;TREC NUTRITION FRANCE;8 capsules;1 compr/15 kg de poids 45 min.avant l’entraîn.Jour de repos:1compr./30kg de poids,30min avant repas;Ne pas dépasser la dose journalière recommandée. Le produit ne doit pas être utilisé comme substitut d’un régime alimentaire équilibré et varié. Le produit n’est pas destiné aux enfants, aux femmes enceintes et allaitantes.;;;Adolescents (moins de 18 ans),Allaitement,Enfants (moins de 12 ans),Enfants en bas âge (1 à 3 ans),Grossesse,Nourrissons (moins de 1 an);;;;Leucine,Isoleucine,Valine,Taurine,Chlorhydrate de pyridoxine,E460,E468,E1202,E171,Hydroxypropyl Méthyl Cellulose,E1203,E172,E553b,E1209,Phosphatidylcholine;Sport
