NomCommercial;Marque;FormeGalenique;ResponsableEtiquetage;DoseJournaliere;ModeEmploi;MisesEnGarde;Gamme;Aromes;population_a_risques;plantes;familles_plantes;parties_plantes;autres_ingredients;objectif_effet
EFIRUB Gommes;;Gomme;LES TROIS CHENES;6 gommes;;Déconseillé avant l'âge de 6 ans. Une consommation excessive peut avoir des effets laxatifs.Déconseillé en cas de traitement médicamenteux concomitant contenant de la guimauve (60 minutes d'intervalle).;;;Allaitement,Grossesse;Althaea officinalis L.,Carica papaya L.,Citrus paradisi Macfad.,Salvia officinalis L.,Sisymbrium officinale (L) Scop.,Zingiber officinale Roscoe;;;E420,E955,E414,E965,E903,huile végétale,menthol,arôme - citron;Voies respiratoires
Citrate de Magnésium;;Comprimé;ANBERMAN TECNOLOGÍAS SL;2 comprimés;;;;;;;;;Sels de magnésium de l'acide citrique,E460,E470b,E551;
macérat de bourgeons cassis;;Compte-gouttes;BENOIT CLEMENTINE;15 gouttes;;;;;Autre (à préciser),Grossesse,Hypertension;Ribes nigrum L.;Grossulariaceae;Bourgeon;Alcool,eau de source,E422;Antioxydant,Articulations,Immunité
Mag 2 PHYTO ENERGIE;Mag 2;Ampoule;COOPERATION PHARMACEUTIQUE FRANCAISE;2;2 ampoules à prendre directement ou à diluer dans un verre d'eau, une fois par jour.;;;orange;Adolescents (moins de 18 ans),Allaitement,Enfants (moins de 12 ans),Enfants en bas âge (1 à 3 ans),Grossesse,Nourrissons (moins de 1 an),Enfants (de moins de 6 ans),Enfants (de moins de 10 ans);Eleutherococcus senticosus (Rupr. et Maxim.) Maxim;Araliaceae;Racine;Eau osmosée,L-pidolate de magnésium,Arôme naturel,E330,E202,E211,E955,Chlorhydrate de pyridoxine;Autre (à préciser),Humeur,Système nerveux
Gélule libido;Jaane;Gélule;CREATIVE CARE;1;1 gélule par jour par voie orale;Consommation interdite aux mineurs et aux femmes enceintes et/ou allaitantes. Ne pas laisser à portée des jeunes enfants. En cas de problème hépatique, consommation fortement déconseillée. Prises d'alcool et/ou médicaments concomitantes fortement déconseillées. Consulter un médecin en cas de doute. Ne pas dépasser la dose journalière recommandée. Conduite : peut provoquer une somnolence. Les compléments alimentaires ne peuvent être utilisés comme substituts d'un régime alimentaire varié et équilibré et d'un mode de vie sain. Conserver au frais, à l'abri de l'humidité.;Nuit pimentée;gingembre;Adolescents (moins de 18 ans),Allaitement,Allergie aux dérivés salicylés,Antécédent de cancer du sein,Calculs rénaux,Déficit congénital en G6PD (favisme),Enfants (moins de 12 ans),Enfants en bas âge (1 à 3 ans),Grossesse,Hypertension,Insuffisance rénale,Maladie rénale,Nourrissons (moins de 1 an),Prise concomittante d'alcool,Prise concomittante d'un contraceptif,Problèmes cardiaques,Problèmes de foie,Sous anticoagulants,Sous antidépresseurs,Sous antidiabétiques,Sous traitement antihypertenseur,Sous traitement médicamenteux,Sous traitement pour la thyroïde,Ulcère (estomac ou duodenum),Enfants (de moins de 6 ans),Enfants (de moins de 10 ans);Cannabis sativa L.,Zingiber officinale Roscoe,Withania somnifera (L.) Dunal;;;huile de noix de coco fractionnée,Phylloquinone,Mélange de tocophérols,Rétinol,E551,Fer élémentaire,E470b,Citrate de potassium - magnésium;Tonus sexuel
GLUTATHION;;Gélule;ONIS VITALITE;500;;Nous vous rappelons qu’un complément alimentaire ne peut se substituer à une nutritiondiversifiée. Ne pas dépasser la dose journalière recommandée et ne pas laisser ce produit à laportée des jeunes enfants. Déconseillé aux enfants et aux adolescents.;;;Adolescents (moins de 18 ans),Enfants (moins de 12 ans),Enfants en bas âge (1 à 3 ans),Nourrissons (moins de 1 an),Enfants (de moins de 6 ans),Enfants (de moins de 10 ans);;;;Glutathion,Acide L-ascorbique,Fibres solubles d''acacia;Antioxydant
SOMMEIL & ENERGIE MATINALE;Valdispert;Comprimé;COOPERATION PHARMACEUTIQUE FRANCAISE;1 comprimé par jour;1 comprimé 30 minutes avant le coucher;Limiter la prise à un usage ponctuelNe pas utiliser chez les enfants de moins de 18 ans, chez les personnes souffrant d'une maladie inflammatoire ou auto-immune, épileptique ou asthmatique, chez les femmes enceintes et en cas d'allaitement, les personnes souffrants de troubles de l'humeur, du comportement ou de la personnalité. Les personnes sous traitement/surveillance médicale doivent demander un avis médical avant de prendre ce produit. Evitez d'utiliser ce produit si vous devez exercer une activité nécessitant une vigilance soutenue (conduite, utilisation de machines,...).;;;Adolescents (moins de 18 ans),Allaitement,Autre (à préciser),Enfants (moins de 12 ans),Enfants en bas âge (1 à 3 ans),Grossesse,Nourrissons (moins de 1 an),Sous traitement médicamenteux,Utilisation prolongée,Enfants (de moins de 6 ans),Enfants (de moins de 10 ans);Crataegus laevigata (Poir.) DC.,Eschscholzia californica Cham.,Melissa officinalis L.,Passiflora incarnata L.;;;Cyanocobalamine,Chlorhydrate de pyridoxine,E464,E463,E401,E415,E460,E551,E470b,Mélatonine,E341,E468,E141,E1202,E471;Autre (à préciser),Sommeil
100% Citrulline Zero;Body Attack;Poudre;Body Attack Sports Nutrition GmbH & Co. KG;5g;;Nahrungsergänzungsmittel sollten nicht als Ersatz für eine ausgewogene, abwechslungsreiche Ernährung und eine gesunde Lebensweise verwendet werden. Außerhalb der Reichweite von kleinen Kindern lagern;;;Enfants en bas âge (1 à 3 ans),Nourrissons (moins de 1 an),Enfants (de moins de 6 ans);;;;L-citrulline malate,Chlorhydrate de pyridoxine;Autre (à préciser)
Collagen with vitamin C;;Poudre;Nutri-Dynamics Health Products BV;10 g;Me´langer une dosette (10 g) dans d’eau, du jus ou du smoothie. A´ prendre une fois par jour. Ne pas;Ce comple´ment alimentaire ne se substitue pas a` un re´gime alimentaire varie´ et e´quilibre´, ni a` un mode de vie sain. Tenir hors de porte´e des jeunes enfants. En cas de doute, consultez votre me´decin ou un spe´cialiste. Ne pas de´passer la dose recommande´e.;;;;;;;Hydrolysat de collagène bovin,Acide L-ascorbique;
Vitamine C poudre;;Poudre;PLANTICINAL;1 cuillère doseuse par jour;1 cuillère doseuse par jour;Complément alimentaire, ne peut être substitué à un régime alimentaire varié et équilibré.A prendre dans le cadre d'un mode de vie sain.Ne pas dépasser la dose journalière recommandée.Tenir hors de portée des jeunes enfants.La supplémentation en Vitamine et minéraux des nourrissons et enfants en bas age doit faire l'objet d'un encadrement médical.;;;Enfants en bas âge (1 à 3 ans),Nourrissons (moins de 1 an);;;;Acide L-ascorbique,L-ascorbate de calcium;
macérat concentré de bourgeon d'argousier;;Autre forme liquide (à préciser);Jérôme Catroux;0,12 grammes;;;;;Allaitement,Grossesse,Sous anticoagulants;Elaeagnus rhamnoides (L.) A.Nelson;Elaeagnaceae;Bourgeon;eau de source,Alcool,sirop d'agave;
Mag2 Gommes BOOST;Mag2;Gomme;COOPERATION PHARMACEUTIQUE FRANCAISE;1 à 3 gommes;Adultes: 1 à 3 gommes par jour.;Les femmes enceintes et allaitantes doivent consulter un professionnel de santé avant de consommer le produit. Une consommation excessive peut entrainer des effets laxatifs. Réservé à l'adulte.;;mandarine;Adolescents (moins de 18 ans),Enfants (moins de 12 ans),Enfants en bas âge (1 à 3 ans),Nourrissons (moins de 1 an),Enfants (de moins de 6 ans),Enfants (de moins de 10 ans);;;;Fructo-oligosaccharides,Eau potable,Acide L-ascorbique,E440,E301,Taurine,Arôme mandarine,E331,Chlorhydrate de pyridoxine,E903,Sels de magnésium de l'acide citrique,amidon;Autre (à préciser),Système nerveux
Mélisse Macérat de plantes fraîches;Les Fées des Herbes;Compte-gouttes;MAGNACCA RAPHAEL;2 X 30 à 40 gouttes /j (80 gouttes max. = 4 ml);A boire dilué dans un peu eau;Conseil d'utilisation : dans un peu d'eau,Adultes : 30 à 40 gouttes avant le repas du soir,30 à 40 gouttes au coucher.Enfants (+ 12 ans) : 1 goutte / kg de poids corporel / jour, de préférence le soir.DJR Max. 80 gouttes/jour soit 4 ml.Recommandations : Tenir hors de portée des enfants. Réservé aux adultes et aux enfants de plus de 12 ans. Ne pas dépasser la dose journalière recommandée (DJR).Déconseillé aux femmes enceintes ou allaitantes, aux personnes intolérantes à l'alcool. Il est recommandée de ne pas conduire ou d'utiliser de machines après la prise. A utiliser dans le cadre d'une alimentation équilibrée et d'un mode de vie sain. Conserver à température ambiante, dans un endroit sec, à l'abri de la lumière.;Alcoolature;;Allaitement,Enfants (moins de 12 ans),Grossesse,Nourrissons (moins de 1 an),Enfants (de moins de 6 ans),Enfants (de moins de 10 ans);Melissa officinalis L.;Lamiaceae;Feuille;Alcool,Eau potable;Antioxydant,Digestion,Humeur,Immunité,Sommeil,Système nerveux
"[""PANDA TAE citron hibiscus"", ""PANDA TAE citron hibiscus""]";;"[""Comprimé"", ""Comprimé""]";"[""PANDA SAS"", ""PANDA SAS""]";"[""3"", ""3""]";;"[""Ne pas dépasser 3 pastilles par jour. Tenir hors de portée des jeunes enfants. À utiliser dans le cadre d’une alimentation variée et équilibrée et d’un mode de vie sain. Conserver dans un endroit sec et frais, à l’abri de la lumière. Les femmes enceintes ou allaitantes doivent consulter un professionnel de santé avant toute complémentation. Une consommation excessive peut avoir des effets laxatifs (max 3 pastilles/jour). Réservé à l’adulte et à l’enfant de plus de 10 ans. Déconseillé aux personnes âgées ou atteintes de néphropathie."", ""Prendre 1 à 3 pastilles par jour. Ne pas dépasser la dose journalière maximale recommandée. À partir de 10 ans. Tenir hors de portée des jeunes enfants. À utiliser dans le cadre d’une alimentation variée et équilibrée et d’un mode de vie sain. Conserver dans un endroit sec et frais, à l’abri de la lumière. Refermer le tube après utilisation. Les femmes enceintes ou allaitantes doivent consulter un professionnel de santé avant toute complémentation. Une consommation excessive peut avoir des effets laxatifs (max 3 pastilles/jour). Déconseillé aux personnes âgées ou atteintes de néphropathie.""]";;;Allaitement,Enfants en bas âge (1 à 3 ans),Grossesse,Nourrissons (moins de 1 an),Enfants (de moins de 6 ans),Enfants (de moins de 10 ans),Allaitement,Enfants en bas âge (1 à 3 ans),Grossesse,Nourrissons (moins de 1 an),Enfants (de moins de 6 ans),Enfants (de moins de 10 ans);;;;;
Aspen;Vall'Espir;Compte-gouttes;PERSPECTIVES;16 gouttes;4 gouttes 4 fois par jour dans un verre d'eau;Ne pas dépasser la dose journalière recommandée. Déconseillé aux enfants, adolescents, femmes enceintes ou allaitantes, aux personnes sous traitement anticoagulant ou souffrant d'allergie aux dérivés salicylés. Tenir hors de portée des jeunes enfants. Ne peut se substituer à un régime alimentaire varié.;Elixirs floraux selon la méthode du Dr Bach;;Adolescents (moins de 18 ans),Allaitement,Allergie aux dérivés salicylés,Enfants (moins de 12 ans),Enfants en bas âge (1 à 3 ans),Grossesse,Nourrissons (moins de 1 an),Sous anticoagulants,Enfants (de moins de 6 ans),Enfants (de moins de 10 ans);Populus tremula L.;Salicaceae;Fleur;Cognac,eau de source;Humeur
NUTRIBOOST PERFORMANCES MASCULINES;;Gélule;SISBEY;2 gélules;Consommation par voie orale;Contient de la caféine (100mg/jour), Respecter les doses conseillées. A conserver dans un endroit frais et sec et à l’abri de la lumière. Consulter un professionnel de santé avant toute utilisation prolongée. Les compléments alimentaires doivent être utilisés dans le cadre d’un mode de vie sain et ne remplacent pas une alimentation variée et équilibrée.;;;Adolescents (moins de 18 ans),Allaitement,Antécédent de cancer du sein,Enfants (moins de 12 ans),Enfants en bas âge (1 à 3 ans),Grossesse,Hypertension,Nourrissons (moins de 1 an),Sous antidiabétiques,Sous traitement antihypertenseur,Enfants (de moins de 6 ans),Enfants (de moins de 10 ans);Withania somnifera (L.) Dunal,Turnera diffusa Willd. ex Schult.,Trigonella foenum-graecum L.,Panax ginseng C.A.Mey.,Lepidium meyenii Walp.,Tribulus terrestris L.;;;Caféine,Citrate de zinc,D-alpha-tocophérol,Cholécalciférol,L-sélénométhionine,E470b;Sport,Tonus sexuel
VITA'MAX BOOSTER 6G;;Ampoule;SANTAROME;1 ampoule par jour;1 ampoule par jour à diluer dans un verre d’eau (20 cl) le matin.;Réservé à l’adulte. Contient de la caféine (12 mg/ampoule), déconseillé aux enfants, adolescents, femmes enceintes ou allaitantes ainsi qu’aux personnes sous traitement antidiabétique. Déconseillé en cas : d’ulcère gastroduodénal, de troubles cardiaques, d’hyperthyroïdie, d’insuffisance cardiaque ou rénale œdémateuses, d’obstruction biliaire (calculs biliaires) ou d’autres troubles de la fonction biliaire. Ne convient pas aux personnes allergiques aux produits de la ruche, ayant de l’asthme ou terrain atopique. En cas de traitements médicamenteux, demander conseil à un professionnel de santé.;;;Adolescents (moins de 18 ans),Allaitement,Autre (à préciser),Enfants (moins de 12 ans),Enfants en bas âge (1 à 3 ans),Grossesse,Insuffisance rénale,Nourrissons (moins de 1 an),Problèmes cardiaques,Problèmes de foie,Sous antidiabétiques,Sous traitement pour la thyroïde,Ulcère (estomac ou duodenum),Enfants (de moins de 6 ans),Enfants (de moins de 10 ans);Malpighia glabra L.,Ribes nigrum L.,Zingiber officinale Roscoe,Zingiber officinale Roscoe,Panax ginseng C.A.Mey.,Lycium barbarum L.,Punica granatum L.,Paullinia cupana Kunth,Paullinia cupana Kunth,Rosmarinus officinalis L.,Sequoiadendron giganteum (Lindl.) J.Buchholz;;;Eau purifiée,Gelée royale,jus de raisin,jus de citron,arôme - orange,E422,Alcool;Autre (à préciser),Immunité,Système nerveux
HSP PROTECT;SOFINNOV;Gélule;NUTRORGANIC S.L.;2 gélules;2 gélules par jour;;ANTIOXYDANT;;Allaitement,Grossesse;Opuntia ficus-indica (L.) Mill.,Paeonia lactiflora Pall.;;;E464,Acétate de DL-alpha-tocophéryle,E470b;Antioxydant,Système nerveux
Vegan Omega-3 Oil;;Flacon;NU3 GMBH;5 ml;: prendre 5ml (1 cuillère à café) par jour;Ne pas dépasser ladose journalière recommandée. Veillezà avoir un régime alimentaire équilibréet varié ainsi qu’un mode de vie sain.Conserver hors de portée des jeunesenfants. Le produit ne doit pas êtreconsommé par les femmes enceintes,les femmes qui allaitent, les enfants etles adolescents de moins de 18 ans.;Santé;;Adolescents (moins de 18 ans),Allaitement,Grossesse;;;;Huile de Schizochytrium sp,huile d'olive,arôme - citron,Cholécalciférol;
Macerat de bourgeons d'Aubepine bio;;Compte-gouttes;Ecomail SRL;5 a 15 gouttes;;;;;Allaitement,Enfants en bas âge (1 à 3 ans),Grossesse,Nourrissons (moins de 1 an);Crataegus laevigata (Poir.) DC.;Rosaceae;Feuille (bourgeon);;
Ananas;Nat&Form;Gélule;ATLANTIC NATURE;4 gélules par jour.;4 gélules par jour. À avaler avec un grand verre d'eau au milieu des repas du midi et du soir.;Réservé à l'adulte. Femmes enceintes ou allaitantes, consulter un professionnel de santé avant utilisation. Déconseillé aux personnes allergiques à l'ananas, au venin d'abeille ou au pollen d'olivier.;Ecoresponsable;;Adolescents (moins de 18 ans);Ananas comosus (L.) Merrill;Bromeliaceae;Tige;gélatine;Minceur / Brûleur
Gymnema sylvestre;HERBORISTERIE DE PARIS;Gélule;HERBORISA NATURA;3 gélules par jour;3 gélules par jour à avaler avec un grand verre d'eau;Déconseillé aux personnes sous traitement antidiabétique.Déconseillé aux femmes enceintes et allaitantes;;;Allaitement,Grossesse,Sous antidiabétiques;Marsdenia sylvestris (Retz.) P.I.Forst.;Apocynaceae;Feuille;Gélule végétale;Minceur / Glycémie
TRIPLE-C 1000®;;Autre forme solide (à préciser);BIOFAR;1 comprimé par jour;1 comprimé par jour, de préférence le matin après le petit déjeuner, à dissoudre dans un grand verre;Réservé à l’adulte.Ne pas utiliser en cas d’hypersensibilité à l’un des ingrédients.Les personnes sous contrôle médical, les femmes enceintes ou allaitantes doivent demander conseil au médecin.;BIOFAR PRO;;Adolescents (moins de 18 ans),Enfants (moins de 12 ans),Enfants en bas âge (1 à 3 ans),Nourrissons (moins de 1 an),Enfants (de moins de 6 ans),Enfants (de moins de 10 ans);Rosa canina L.;Rosaceae;Fruit;E330,E296,E170,E504,E501,Acide L-ascorbique,Citroflavonoïdes,L-ascorbate de calcium,Hydrolysat de protéines,levure,Arôme,Concentré de carthame,poudre de citron,E968,E955,Inuline,poudre de betterave,Fibres d''agrumes;Antioxydant,Immunité,Os,Peau,Santé bucco-dentaire,Système nerveux
Poivre;ELIXALP;Flacon;ELIXALP;30 GOUTTES;15 gouttes deux fois par jour dans un verre d'eau.;Déconseillé aux enfantsde moins de 12ans.Respecter la dose journalière. Ne remplace pas une alimentation, variée et équilibrée.Tenir hors de portée des enfants.;;;Enfants (moins de 12 ans);Piper nigrum L.;Piperaceae;Fruit;;
Oleopolis sirop gorge;Diétaroma;Sirop;THERA VIVA;15 ml;Prendre 1 cuillère à soupe 1 à 2 fois par jour.;Déconseillé aux enfants de moins de 12 ans. Ne pas dépasser la durée de cure. Déconseillé aux femmes enceintes et allaitantes. Déconseillé en cas de pathologie du système immunitaire, de reflux gastro-oesophagien, d’ulcère gastro-duodénal, de gastrite ou de troubles biliaires et/ou hépatiques, d’insuffisance rénale, d’antécédents d’épilepsie, d’antécédents de convulsions ou d’antécédent de pathologies neurologiques et en cas de traitement à ces pathologies. Déconseillé en cas de consommation concomitante d’autre produit contenant de la menthe poivrée sous un autre type de préparation. Déconseillé en cas d’allergie aumenthol, aux plantes de la famille des Astéracée, des Lamiacées, aux pollens et aux personnes prédisposées à l’asthme.;;naturel;Adolescents (moins de 18 ans),Allaitement,Enfants (moins de 12 ans),Enfants en bas âge (1 à 3 ans),Grossesse,Nourrissons (moins de 1 an),Enfants (de moins de 6 ans),Enfants (de moins de 10 ans);Citrus limon (L.) Burm. f.,Echinacea purpurea (L.) Moench,Eucalyptus radiata A.Cunn. ex DC.,Althaea officinalis L.,Mentha x piperita L.,Pinus sylvestris L.,Plantago lanceolata L.,Thymus vulgaris L.;;;Propolis,miel,sirop d'agave,Eau potable;Immunité,Voies respiratoires
MARINE COLLAGEN;SUPERSET NUTRITION;Poudre;FITCORP;12 g;Prendre une dose de 12 g (une dosette et demie) dans 250 ml d’eau froide.;PRÉCAUTIONS : les compléments alimentaires doivent être utilisés dans le cadre d’un mode de vie sain et ne pas être utilisés comme substituts d’un régime alimentaire varié et équilibré. Une consommation excessive d’édulcorants peut avoir des effets laxatifs. Ne pas dépasser la dose journalière recommandée. Tenir hors de portée des enfants.CONSERVATION : conserver bien fermé, dans un endroit sec entre 5-30°C. Ne pas exposer à la chaleur, la lumière ou l’humidité.TRACES POSSIBLES : lait, oeufs, soja, gluten, cacahuètes, noix, céleri, poisson, crustacés, mollusques et aliments contenant du dioxyde de soufre.;;Orange;;;;;Collagène marin,E330,E296,E1200,Arômes,Hyaluronate de sodium,Acide L-ascorbique,E955,E101,maltodextrine,poudre de betterave,E900,E551;Antioxydant,Articulations,Sport
NATTOKINASE 100 mg;;Capsule;Vision Healthcare B.V.;1 gélule;;Les compléments alimentaires ne doivent pas être utilisés en remplacement d‘une alimentation saine et varié. Tenir hors de portée des jeunes enfants. Ne pas dépasser la dose journalière recommandée.Déconseillé aux femmes enceintes et allaitantes ainsi qu‘aux personnes ayant des antécédents familiaux ou personnels de cancer du sein. Si vous prenez des anticoagulants, des antiplaquettaires ou d‘autres médicaments,ou si vous souffrez d‘un trouble de la coagulation, consultez votre médecin avant de prendre le produit. /;;;Autre (à préciser);Glycine max. (L.) Merr.;Leguminosae;Graine;E464,dextrine,amidon de maïs;
Huile de foie de requin;Algotonic;Capsule;ALGOTONIC;4 capsules;3 à 4 capsules par jour, 2 le matin et 2 le soir;;;;;;;;huile de foie de requin;Immunité
Vitalité;Acti'Form;Gélule;Madame LE GUYADER Sophie;2;Prendre 2 gélules par jour, avec un grand verre d'eau au moment des repas;"Réservé à l'adulte. Tenir hors de portée des enfants. Ne pas dépasser la dose journalière recommandée. A utiliser dans le cadre d'un régime alimentaire varié, équilibré et d'un mode de vie sain. A conserver dans un endroit sec et frais. Déconseillé chez les personnes sous traitement anti-diabétique ; chez les femmes enceintes et allaitantes. En cas de traitement médicamenteux demandez conseil à un professionnel de santé.";;;Adolescents (moins de 18 ans),Allaitement,Grossesse,Sous antidiabétiques;Malpighia glabra L.,Panax ginseng C.A.Mey.;;;Gelée royale lyophilisée,Pollen,Propolis;Concentration,Humeur,Immunité,Mémoire
Tout-en-un ajustée;Acti'Form;Gélule;Madame LE GUYADER Sophie;2;Prendre 2 gélules par jour, avec un grand verre d'eau au moment des repas;"Réservé à l'adulte. Tenir hors de portée des enfants. Ne pas dépasser la dose journalière recommandée. A utiliser dans le cadre d'un régime alimentaire varié, équilibré et d'un mode de vie sain. A conserver dans un endroit sec et frais. Déconseillé chez les femmes enceintes et allaitantes ; chez des personnes sous anticoagulant ; chez des personnes sous traitement anti-dépresseur ; en cas d'allergie croisée connue, en particulier aux plantes de la famille des Asteraceae (Vergerette du Canada).";;;Adolescents (moins de 18 ans),Allaitement,Grossesse,Sous anticoagulants,Sous antidépresseurs;Malpighia glabra L.,Aesculus hippocastanum L.,Bambusa bambos (L.) Voss,Crataegus curvisepala Lindm.,Cucurbita pepo L.,Erigeron canadensis L.,Griffonia simplicifolia (DC.) Baill.,Hamamelis virginiana L.,Lycium barbarum L.,Ruscus aculeatus L.,Vaccinium myrtillus L.,Vitis vinifera L.;;;Cholécalciférol,Bisglycinate de magnésium,Riboflavine,Gelée royale lyophilisée,Pollen,Nicotinamide,D-pantothénate de calcium,Chlorhydrate de pyridoxine,Acide ptéroylmonoglutamique,Cyanocobalamine;Articulations,Circulation sanguine et lymphatique,Concentration,Œil / Vision
GEMMO NUIT;SANTANE;Compte-gouttes;LABORATOIRES IPHYM;15 gouttes (0,75 ml);10 à 15 gouttes (0,5 à 0,75 ml) 1/4H avant un repas;Déconseillé aux enfants de moins de 12 ans, aux femmes enceintes etallaintantes et en cas d’allergie aux dérivés salicylés et d’intolérance aux antiinflammatoiresnon-stéroïdiensaux. Ne pas dépasser la dose journalièreindiquée. SANTANE GEMMO NUIT est un complément alimentaire qui ne sesubstitue pas à un régime alimentaire varié et sera utilisé dans le cadre d'unmode de vie sain. Tenir hors de portée des enfants. Attention, l'abus d'alcoolest dangereux pour la santé.;SANTANE GEMMO;;Allaitement,Allergie aux dérivés salicylés,Autre (à préciser),Enfants (moins de 12 ans),Grossesse;Betula pubescens Ehrh.,Olea europaea L.,Tilia tomentosa Moench;;;Eau purifiée,Alcool éthylique,E422;
Super Guarana;Scitec Nutrition;Comprimé;BioTechUSA Kft.;1x2 comprimés;Il ne doit pas être consommé à jeun ou avant de se coucher.;Contient de la caféine [200 mg/ dose journalière]. Consommation déconseillée avant l’âge de 18 ans et aux femmes enceintes. Consommation déconseillée  en cas de maladie sous-jacent ou sous traitement médicamental.  Déconseillé aux personnes souffrant de maladies cardiovasculaires, d’hypertension artérielle, de sensibilité à la caféine, en cas d’ulcère gastro-duodénal et/ou de problèmes cardiaques et/ou d’hyperthyroïdie.;;;Adolescents (moins de 18 ans),Allaitement,Enfants (moins de 12 ans),Grossesse,Nourrissons (moins de 1 an),Problèmes cardiaques,Sous traitement antihypertenseur,Sous traitement médicamenteux,Sous traitement pour la thyroïde,Enfants (de moins de 6 ans),Enfants (de moins de 10 ans);Paullinia cupana Kunth;Sapindaceae;Graine;Carbonate de calcium,E460,E551,E470b,E1209,E1203,E553b,E471;Sport
ABUMIN PLUS;;Gélule;LUSTREL LABORATOIRES;2 gélules par jours;;Il est conseillé aux femmes enceintes et allaitantes de prendre l’attache d’un professionnel de santé avant toute complémentation.;;;Autre (à préciser);;;;Ovalbumine,Hydrolysat de collagène bovin,L-isoleucine,Chlorhydrate de L-arginine,L-cystine,Méthionine,E470b,Bêta-alanine,Bêtaglucanes,gélatine;
NATTOKINASE NSK-SD;QUALIDIET;Gélule;VITAL OSMOSE;2;Prendre 1 à 2 gélules par jour avec de l'eau;Ne pas dépasser la dose journalière conseillée. Ne doit pas être utilisé comme substitut d’un régime alimentaire varié et équilibré ni d’un mode de vie sain.Tenir hors de portée des enfants.Produit réservé à l’adulte. Déconseillé aux femmes enceintes et allaitantes ainsi qu’aux femmes ayant des antécédents personnels ou familiaux de cancer du sein. Déconseillé aux personnes allergiques au soja. Les personnes prenant des médicaments ne devraient consommer ce produit que sous contrôle médical.;;;Allaitement,Antécédent de cancer du sein,Autre (à préciser),Enfants (moins de 12 ans),Grossesse,Sous traitement médicamenteux;Glycine max. (L.) Merr.,Vitis vinifera L.;;;Hydroxypropyl Méthyl Cellulose,Chlorhydrate de thiamine;Autre (à préciser)
WHEY BLUE KING;;Poudre;AMERICAN SUPLEMENT;30 g;;Voir dans l´etiquetage;;STRAWBERRY FLAVOURED;Autre (à préciser);;;;Protéine de lactosérum,E640,maltodextrine,Créatine monohydrate,Taurine,Arômes,Poudre de fraise,yaourt,E330,E955,E950,Amylase,Protéase,Lactase,Lipase,Cellulase,Chlorhydrate de pyridoxine,E122;
WHEY BLUE KING;;Poudre;AMERICAN SUPLEMENT;30 g;;;;COOKIES & CREAM FLAVOURED;Autre (à préciser);;;;Protéine de lactosérum,E640,maltodextrine,Monohydrate de créatine,Taurine,Arômes,E955,E950,Amylase,Protéase,Lactase,Lipase,Cellulase,Chlorhydrate de pyridoxine;
